,"Josh Allen  J. Allen  (QB, BUF)"
0,"Jalen Hurts  J. Hurts  (QB, PHI)"
1,"Christian McCaffrey  C. McCaffrey  (RB, SF)"
2,"Tyreek Hill  T. Hill  (WR, MIA)"
3,"Patrick Mahomes  P. Mahomes  (QB, KC)"
4,"C.J. Stroud  C. Stroud  (QB, HOU)"
5,"Anthony Richardson  A. Richardson  (QB, IND)"
6,"Lamar Jackson  L. Jackson  (QB, BAL)"
7,"Bijan Robinson  B. Robinson  (RB, ATL)"
8,"Amon-Ra St. Brown  A. St. Brown  (WR, DET)"
9,"Breece Hall  B. Hall  (RB, NYJ)"
10,"Justin Jefferson  J. Jefferson  (WR, MIN)"
11,"Joe Burrow  J. Burrow  (QB, CIN)"
12,"Tua Tagovailoa  T. Tagovailoa  (QB, MIA)"
13,"CeeDee Lamb  C. Lamb  (WR, DAL)"
14,"Trevor Lawrence  T. Lawrence  (QB, JAC)"
15,"Puka Nacua  P. Nacua  (WR, LA)"
16,"Kyler Murray  K. Murray  (QB, ARI)"
17,"Caleb Williams  C. Williams  (QB, CHI)"
18,"Jayden Daniels  J. Daniels  (QB, WSH)"
19,"Jordan Love  J. Love  (QB, GB)"
20,"Matthew Stafford  M. Stafford  (QB, LA)"
21,"Jared Goff  J. Goff  (QB, DET)"
22,"A.J. Brown  A. Brown  (WR, PHI)"
23,"Jahmyr Gibbs  J. Gibbs  (RB, DET)"
24,"Ja'Marr Chase  J. Chase  (WR, CIN)"
25,"Justin Herbert  J. Herbert  (QB, LAC)"
26,"Deshaun Watson  D. Watson  (QB, CLE)"
27,"Garrett Wilson  G. Wilson  (WR, NYJ)"
28,"Alvin Kamara  A. Kamara  (RB, NO)"
29,"Kirk Cousins  K. Cousins  (QB, ATL)"
30,"Saquon Barkley  S. Barkley  (RB, PHI)"
31,"Geno Smith  G. Smith  (QB, SEA)"
32,"Jaylen Waddle  J. Waddle  (WR, MIA)"
33,"Baker Mayfield  B. Mayfield  (QB, TB)"
34,"Cooper Kupp  C. Kupp  (WR, LA)"
35,"Justin Fields  J. Fields  (QB, PIT)"
36,"De'Von Achane  D. Achane  (RB, MIA)"
37,"Sam LaPorta  S. LaPorta  (TE, DET)"
38,"Drake London  D. London  (WR, ATL)"
39,"Jonathan Taylor  J. Taylor  (RB, IND)"
40,"Josh Jacobs  J. Jacobs  (RB, GB)"
41,"Daniel Jones  D. Jones  (QB, NYG)"
42,"Nico Collins  N. Collins  (WR, HOU)"
43,"Travis Kelce  T. Kelce  (TE, KC)"
44,"Aaron Rodgers  A. Rodgers  (QB, NYJ)"
45,"Rachaad White  R. White  (RB, TB)"
46,"Marvin Harrison Jr.  M. Harrison  (WR, ARI)"
47,"Travis Etienne  T. Etienne  (RB, JAC)"
48,"Michael Pittman Jr.  M. Pittman Jr.  (WR, IND)"
49,"Brock Purdy  B. Purdy  (QB, SF)"
50,"Sam Darnold  S. Darnold  (QB, MIN)"
51,"Dak Prescott  D. Prescott  (QB, DAL)"
52,"Joe Mixon  J. Mixon  (RB, HOU)"
53,"Chris Olave  C. Olave  (WR, NO)"
54,"Will Levis  W. Levis  (QB, TEN)"
55,"Kenneth Walker III  K. Walker  (RB, SEA)"
56,"Stefon Diggs  S. Diggs  (WR, HOU)"
57,"Derek Carr  D. Carr  (QB, NO)"
58,"Derrick Henry  D. Henry  (RB, BAL)"
59,"DeVonta Smith  D. Smith  (WR, PHI)"
60,"Malik Nabers  M. Nabers  (WR, NYG)"
61,"James Cook  J. Cook  (RB, BUF)"
62,"Dalton Kincaid  D. Kincaid  (TE, BUF)"
63,"Mike Evans  M. Evans  (WR, TB)"
64,"Trey McBride  T. McBride  (TE, ARI)"
65,"Davante Adams  D. Adams  (WR, LV)"
66,"Rashee Rice  R. Rice  (WR, KC)"
67,"Jerome Ford  J. Ford  (RB, CLE)"
68,"Bryce Young  B. Young  (QB, CAR)"
69,"D.J. Moore  D. Moore  (WR, CHI)"
70,"Tank Dell  T. Dell  (WR, HOU)"
71,"Bo Nix  B. Nix  (QB, DEN)"
72,"Christian Kirk  C. Kirk  (WR, JAC)"
73,"D.K. Metcalf  D. Metcalf  (WR, SEA)"
74,"Aaron Jones  A. Jones  (RB, MIN)"
75,"Jacoby Brissett  J. Brissett  (QB, NE)"
76,"Gardner Minshew  G. Minshew  (QB, LV)"
77,"Keenan Allen  K. Allen  (WR, CHI)"
78,"Chris Godwin  C. Godwin  (WR, TB)"
79,"Kyle Pitts  K. Pitts  (TE, ATL)"
80,"Chuba Hubbard  C. Hubbard  (RB, CAR)"
81,"Kyren Williams  K. Williams  (RB, LA)"
82,"Mark Andrews  M. Andrews  (TE, BAL)"
83,"Isiah Pacheco  I. Pacheco  (RB, KC)"
84,"Deebo Samuel  D. Samuel  (WR, SF)"
85,"Diontae Johnson  D. Johnson  (WR, CAR)"
86,"Brandon Aiyuk  B. Aiyuk  (WR, SF)"
87,"Zay Flowers  Z. Flowers  (WR, BAL)"
88,"Josh Palmer  J. Palmer  (WR, LAC)"
89,"Calvin Ridley  C. Ridley  (WR, TEN)"
90,"Evan Engram  E. Engram  (TE, JAC)"
91,"Rhamondre Stevenson  R. Stevenson  (RB, NE)"
92,"Amari Cooper  A. Cooper  (WR, CLE)"
93,"Terry McLaurin  T. McLaurin  (WR, WSH)"
94,"George Pickens  G. Pickens  (WR, PIT)"
95,"David Montgomery  D. Montgomery  (RB, DET)"
96,"Jaxon Smith-Njigba  J. Smith-Njigba  (WR, SEA)"
97,"Ladd McConkey  L. McConkey  (WR, LAC)"
98,"Jayden Reed  J. Reed  (WR, GB)"
99,"Xavier Worthy  X. Worthy  (WR, KC)"
100,"Rome Odunze  R. Odunze  (WR, CHI)"
101,"Brian Thomas Jr.  B. Thomas  (WR, JAC)"
102,"Chase Brown  C. Brown  (RB, CIN)"
103,"Zamir White  Z. White  (RB, LV)"
104,"Tony Pollard  T. Pollard  (RB, TEN)"
105,"Javonte Williams  J. Williams  (RB, DEN)"
106,"Christian Watson  C. Watson  (WR, GB)"
107,"DeAndre Hopkins  D. Hopkins  (WR, TEN)"
108,"Andrei Iosivas  A. Iosivas  (WR, CIN)"
109,"George Kittle  G. Kittle  (TE, SF)"
110,"Devin Singletary  D. Singletary  (RB, NYG)"
111,"Courtland Sutton  C. Sutton  (WR, DEN)"
112,"Adam Thielen  A. Thielen  (WR, CAR)"
113,"Raheem Mostert  R. Mostert  (RB, MIA)"
114,"Jameson Williams  J. Williams  (WR, DET)"
115,"James Conner  J. Conner  (RB, ARI)"
116,"David Njoku  D. Njoku  (TE, CLE)"
117,"Austin Ekeler  A. Ekeler  (RB, WSH)"
118,"Jake Ferguson  J. Ferguson  (TE, DAL)"
119,"Tyler Lockett  T. Lockett  (WR, SEA)"
120,"Khalil Shakir  K. Shakir  (WR, BUF)"
121,"Ja'Lynn Polk  J. Polk  (WR, NE)"
122,"Jordan Addison  J. Addison  (WR, MIN)"
123,"D'Andre Swift  D. Swift  (RB, CHI)"
124,"Zack Moss  Z. Moss  (RB, CIN)"
125,"Curtis Samuel  C. Samuel  (WR, BUF)"
126,"Jerry Jeudy  J. Jeudy  (WR, CLE)"
127,"Jaylen Warren  J. Warren  (RB, PIT)"
128,"Jakobi Meyers  J. Meyers  (WR, LV)"
129,"Brock Bowers  B. Bowers  (TE, LV)"
130,"Romeo Doubs  R. Doubs  (WR, GB)"
131,"Dallas Goedert  D. Goedert  (TE, PHI)"
132,"Tyjae Spears  T. Spears  (RB, TEN)"
133,"Adonai Mitchell  A. Mitchell  (WR, IND)"
134,"Najee Harris  N. Harris  (RB, PIT)"
135,"Demario Douglas  D. Douglas  (WR, NE)"
136,"Gabriel Davis  G. Davis  (WR, JAC)"
137,"Dalton Schultz  D. Schultz  (TE, HOU)"
138,"Brian Robinson  B. Robinson  (RB, WSH)"
139,"Blake Corum  B. Corum  (RB, LA)"
140,"Khalil Herbert  K. Herbert  (RB, CHI)"
141,"Wan'Dale Robinson  W. Robinson  (WR, NYG)"
142,"Ezekiel Elliott  E. Elliott  (RB, DAL)"
143,"Brandin Cooks  B. Cooks  (WR, DAL)"
144,"Antonio Gibson  A. Gibson  (RB, NE)"
145,"Dontayvion Wicks  D. Wicks  (WR, GB)"
146,"Rashid Shaheed  R. Shaheed  (WR, NO)"
147,"Gus Edwards  G. Edwards  (RB, LAC)"
148,"Noah Brown  N. Brown  (WR, WSH)"
149,"Samaje Perine  S. Perine  (RB, KC)"
150,"Jalin Hyatt  J. Hyatt  (WR, NYG)"
151,"Alec Pierce  A. Pierce  (WR, IND)"
152,"Keon Coleman  K. Coleman  (WR, BUF)"
153,"Darnell Mooney  D. Mooney  (WR, ATL)"
154,"Taysom Hill  T. Hill  (TE, NO)"
155,"Hunter Henry  H. Henry  (TE, NE)"
156,"Luke Musgrave  L. Musgrave  (TE, GB)"
157,"Ty Chandler  T. Chandler  (RB, MIN)"
158,"Juwan Johnson  J. Johnson  (TE, NO)"
159,"Darius Slayton  D. Slayton  (WR, NYG)"
160,"Miles Sanders  M. Sanders  (RB, CAR)"
161,"Zach Charbonnet  Z. Charbonnet  (RB, SEA)"
162,"Allen Lazard  A. Lazard  (WR, NYJ)"
163,"Trenton Irwin  T. Irwin  (WR, CIN)"
164,"Rashod Bateman  R. Bateman  (WR, BAL)"
165,"Mike Williams  M. Williams  (WR, NYJ)"
166,"Josh Reynolds  J. Reynolds  (WR, DEN)"
167,"Noah Fant  N. Fant  (TE, SEA)"
168,"Hayden Hurst  H. Hurst  (TE, LAC)"
169,"Jamaal Williams  J. Williams  (RB, NO)"
170,"Chigoziem Okonkwo  C. Okonkwo  (TE, TEN)"
171,"Marvin Mims  M. Mims  (WR, DEN)"
172,"Michael Wilson  M. Wilson  (WR, ARI)"
173,"Mike Gesicki  M. Gesicki  (TE, CIN)"
174,"Jonnu Smith  J. Smith  (TE, MIA)"
175,"Rico Dowdle  R. Dowdle  (RB, DAL)"
176,"Tyler Allgeier  T. Allgeier  (RB, ATL)"
177,"Tyler Conklin  T. Conklin  (TE, NYJ)"
178,"Cade Otton  C. Otton  (TE, TB)"
179,"Jaleel McLaughlin  J. McLaughlin  (RB, DEN)"
180,"Isaiah Likely  I. Likely  (TE, BAL)"
181,"Demarcus Robinson  D. Robinson  (WR, LA)"
182,"Quentin Johnston  Q. Johnston  (WR, LAC)"
183,"Trey Benson  T. Benson  (RB, ARI)"
184,"Tyler Boyd  T. Boyd  (WR, TEN)"
185,"Xavier Legette  X. Legette  (WR, CAR)"
186,"Pat Freiermuth  P. Freiermuth  (TE, PIT)"
187,"Zach Ertz  Z. Ertz  (TE, WSH)"
188,"Jalen McMillan  J. McMillan  (WR, TB)"
189,"J.K. Dobbins  J. Dobbins  (RB, LAC)"
190,"Kylen Granson  K. Granson  (TE, IND)"
191,"Bucky Irving  B. Irving  (RB, TB)"
192,"Will Dissly  W. Dissly  (TE, LAC)"
193,"Jahan Dotson  J. Dotson  (WR, PHI)"
194,"Daniel Bellinger  D. Bellinger  (TE, NYG)"
195,"Cole Kmet  C. Kmet  (TE, CHI)"
196,"Trey Palmer  T. Palmer  (WR, TB)"
197,"Gerald Everett  G. Everett  (TE, CHI)"
198,"Colby Parkinson  C. Parkinson  (TE, LA)"
199,"Cedrick Wilson  C. Wilson  (WR, NO)"
200,"Dyami Brown  D. Brown  (WR, WSH)"
201,"Alexander Mattison  A. Mattison  (RB, LV)"
202,"Jordan Mason  J. Mason  (RB, SF)"
203,"Ray-Ray McCloud  R. McCloud  (WR, ATL)"
204,"Emanuel Wilson  E. Wilson  (RB, GB)"
205,"Ray Davis  R. Davis  (RB, BUF)"
206,"Braxton Berrios  B. Berrios  (WR, MIA)"
207,"Justin Watson  J. Watson  (WR, KC)"
208,"Jonathan Mingo  J. Mingo  (WR, CAR)"
209,"Elijah Moore  E. Moore  (WR, CLE)"
210,"Greg Dulcich  G. Dulcich  (TE, DEN)"
211,"Dawson Knox  D. Knox  (TE, BUF)"
212,"Kalif Raymond  K. Raymond  (WR, DET)"
213,"Calvin Austin III  C. Austin  (WR, PIT)"
214,"Greg Dortch  G. Dortch  (WR, ARI)"
215,"Tucker Kraft  T. Kraft  (TE, GB)"
216,"Braelon Allen  B. Allen  (RB, NYJ)"
217,"Josh Oliver  J. Oliver  (TE, MIN)"
218,"Van Jefferson  V. Jefferson  (WR, PIT)"
219,"D'Onta Foreman  D. Foreman  (RB, CLE)"
220,"Tank Bigsby  T. Bigsby  (RB, JAC)"
221,"Tyrone Tracy Jr.  T. Tracy  (RB, NYG)"
222,"Kimani Vidal  K. Vidal  (RB, LAC)"
223,"Jalen Tolbert  J. Tolbert  (WR, DAL)"
224,"K.J. Osborn  K. Osborn  (WR, NE)"
225,"Mack Hollins  M. Hollins  (WR, BUF)"
226,"Jauan Jennings  J. Jennings  (WR, SF)"
227,"Tre Tucker  T. Tucker  (WR, LV)"
228,"Jalen Nailor  J. Nailor  (WR, MIN)"
229,"Alex Erickson  A. Erickson  (WR, LAC)"
230,"Davis Allen  D. Allen  (TE, LA)"
231,"Justice Hill  J. Hill  (RB, BAL)"
232,"Nelson Agholor  N. Agholor  (WR, BAL)"
233,"Dalvin Cook  D. Cook  (RB, DAL)"
234,"Malachi Corley  M. Corley  (WR, NYJ)"
235,"Johnny Mundt  J. Mundt  (TE, MIN)"
236,"Charlie Jones  C. Jones  (WR, CIN)"
237,"Ashton Dulin  A. Dulin  (WR, IND)"
238,"Michael Mayer  M. Mayer  (TE, LV)"
239,"Cedric Tillman  C. Tillman  (WR, CLE)"
240,"Darnell Washington  D. Washington  (TE, PIT)"
241,"A.T. Perry  A. Perry  (WR, NO)"
242,"Dameon Pierce  D. Pierce  (RB, HOU)"
243,"Parker Washington  P. Washington  (WR, JAC)"
244,"Phillip Dorsett  P. Dorsett  (WR, DEN)"
245,"Luke McCaffrey  L. McCaffrey  (WR, WSH)"
246,"Cordarrelle Patterson  C. Patterson  (RB, PIT)"
247,"Audric Estime  A. Estime  (RB, DEN)"
248,"KaVontae Turpin  K. Turpin  (WR, DAL)"
249,"Tyquan Thornton  T. Thornton  (WR, NE)"
250,"Cam Akers  C. Akers  (RB, HOU)"
251,"Tutu Atwell  T. Atwell  (WR, LA)"
252,"Roschon Johnson  R. Johnson  (RB, CHI)"
253,"Brandon Powell  B. Powell  (WR, MIN)"
254,"Khadarel Hodge  K. Hodge  (WR, ATL)"
255,"Tanner Hudson  T. Hudson  (TE, CIN)"
256,"Jamison Crowder  J. Crowder  (WR, WSH)"
257,"Josh Whyle  J. Whyle  (TE, TEN)"
258,"Luke Schoonmaker  L. Schoonmaker  (TE, DAL)"
259,"Mo Alie-Cox  M. Alie-Cox  (TE, IND)"
260,"JuJu Smith-Schuster  J. Smith-Schuster  (WR, KC)"
261,"Jordan Matthews  J. Matthews  (TE, CAR)"
262,"Javon Baker  J. Baker  (WR, NE)"
263,"Trent Sherfield  T. Sherfield  (WR, MIN)"
264,"Kenneth Gainwell  K. Gainwell  (RB, PHI)"
265,"Pharaoh Brown  P. Brown  (TE, SEA)"
266,"Zay Jones  Z. Jones  (WR, ARI)"
267,"Treylon Burks  T. Burks  (WR, TEN)"
268,"Ben Sinnott  B. Sinnott  (TE, WSH)"
269,"John Metchie III  J. Metchie  (WR, HOU)"
270,"Austin Hooper  A. Hooper  (TE, NE)"
271,"Jermaine Burton  J. Burton  (WR, CIN)"
272,"Trey Sermon  T. Sermon  (RB, IND)"
273,"Donald Parham Jr.  D. Parham Jr.  (TE, DEN)"
274,"Noah Gray  N. Gray  (TE, KC)"
275,"Will Mallory  W. Mallory  (TE, IND)"
276,"David Moore  D. Moore  (WR, CAR)"
277,"Dylan Laube  D. Laube  (RB, LV)"
278,"Ty Johnson  T. Johnson  (RB, BUF)"
279,"Xavier Gipson  X. Gipson  (WR, NYJ)"
280,"Scotty Miller  S. Miller  (WR, PIT)"
281,"Adam Trautman  A. Trautman  (TE, DEN)"
282,"Jaylen Wright  J. Wright  (RB, MIA)"
283,"Deven Thompkins  D. Thompkins  (WR, CAR)"
284,"Jake Bobo  J. Bobo  (WR, SEA)"
285,"John Bates  J. Bates  (TE, WSH)"
286,"Eric Gray  E. Gray  (RB, NYG)"
287,"Foster Moreau  F. Moreau  (TE, NO)"
288,"Carson Steele  C. Steele  (RB, KC)"
289,"Devin Duvernay  D. Duvernay  (WR, JAC)"
290,"Hunter Long  H. Long  (TE, LA)"
291,"David Bell  D. Bell  (WR, CLE)"
292,"Kyle Juszczyk  K. Juszczyk  (RB, SF)"
293,"Pierre Strong Jr.  P. Strong Jr.  (RB, CLE)"
294,"Simi Fehoko  S. Fehoko  (WR, LAC)"
295,"Jordan Akins  J. Akins  (TE, CLE)"
296,"Olamide Zaccheaus  O. Zaccheaus  (WR, WSH)"
297,"Jalen Brooks  J. Brooks  (WR, DAL)"
298,"Damiere Byrd  D. Byrd  (WR, BUF)"
299,"Will Shipley  W. Shipley  (RB, PHI)"
300,"Brevin Jordan  B. Jordan  (TE, HOU)"
301,"Nick Westbrook-Ikhine  N. Westbrook-Ikhine  (WR, TEN)"
302,"Brock Wright  B. Wright  (TE, DET)"
303,"Marquez Valdes-Scantling  M. Valdes-Scantling  (WR, BUF)"
304,"Kawaan Baker  K. Baker  (WR, NE)"
305,"Mecole Hardman  M. Hardman  (WR, KC)"
306,"Robert Woods  R. Woods  (WR, HOU)"
307,"Stone Smartt  S. Smartt  (TE, LAC)"
308,"Robbie Chosen  R. Chosen  (WR, MIA)"
309,"JaMycal Hasty  J. Hasty  (RB, NE)"
310,"Tyrie Cleveland  T. Cleveland  (WR, IND)"
311,"Britain Covey  B. Covey  (WR, PHI)"
312,"Deonte Harty  D. Harty  (WR, BAL)"
313,"Chris Moore  C. Moore  (WR, ARI)"
314,"Jalen Reagor  J. Reagor  (WR, NE)"
315,"Durham Smythe  D. Smythe  (TE, MIA)"
316,"Drew Sample  D. Sample  (TE, CIN)"
317,"Sean Tucker  S. Tucker  (RB, TB)"
318,"D'Ernest Johnson  D. Johnson  (RB, JAC)"
319,"Jeremy Ruckert  J. Ruckert  (TE, NYJ)"
320,"Nick Muse  N. Muse  (TE, MIN)"
321,"Giovanni Ricci  G. Ricci  (RB, CLE)"
322,"Easop Winston Jr.  E. Winston Jr.  (WR, SEA)"
323,"Dareke Young  D. Young  (WR, SEA)"
324,"Emari Demercado  E. Demercado  (RB, ARI)"
325,"Raheem Blackshear  R. Blackshear  (RB, CAR)"
326,"Gunner Olszewski  G. Olszewski  (WR, NYG)"
327,"Ameer Abdullah  A. Abdullah  (RB, LV)"
328,"Hunter Luepke  H. Luepke  (RB, DAL)"
329,"Zach Pascal  Z. Pascal  (WR, ARI)"
330,"Charlie Woerner  C. Woerner  (TE, ATL)"
331,"Julian Hill  J. Hill  (TE, MIA)"
332,"Reggie Gilliam  R. Gilliam  (RB, BUF)"
333,"Josh Ali  J. Ali  (WR, ATL)"
334,"Austin Mack  A. Mack  (WR, ATL)"
335,"Deuce Vaughn  D. Vaughn  (RB, DAL)"
336,"Tyler Johnson  T. Johnson  (WR, LA)"
337,"Skyy Moore  S. Moore  (WR, KC)"
338,"Grant Calcaterra  G. Calcaterra  (TE, PHI)"
339,"Andrew Ogletree  A. Ogletree  (TE, IND)"
340,"Ronnie Rivers  R. Rivers  (RB, LA)"
341,"Ko Kieft  K. Kieft  (TE, TB)"
342,"Anthony Firkser  A. Firkser  (TE, NYJ)"
343,"Derius Davis  D. Davis  (WR, LAC)"
344,"Cam Sims  C. Sims  (WR, CAR)"
345,"Michael Burton  M. Burton  (RB, DEN)"
346,"Jalen Guyton  J. Guyton  (WR, LV)"
347,"Elijah Higgins  E. Higgins  (TE, ARI)"
348,"Lucas Krull  L. Krull  (TE, DEN)"
349,"Jeff Wilson  J. Wilson  (RB, MIA)"
350,"Ihmir Smith-Marsette  I. Smith-Marsette  (WR, CAR)"
351,"Jalen Camp  J. Camp  (WR, CAR)"
352,"Avery Williams  A. Williams  (RB, ATL)"
353,"Ronnie Bell  R. Bell  (WR, SF)"
354,"Chris Conley  C. Conley  (WR, SF)"
355,"MyCole Pruitt  M. Pruitt  (TE, PIT)"
356,"Harrison Bryant  H. Bryant  (TE, LV)"
357,"Connor Heyward  C. Heyward  (TE, PIT)"
358,"Laviska Shenault  L. Shenault  (WR, SEA)"
359,"Marquez Callaway  M. Callaway  (WR, PIT)"
360,"Velus Jones  V. Jones  (WR, CHI)"
361,"Kevin Harris  K. Harris  (RB, NE)"
362,"Israel Abanikanda  I. Abanikanda  (RB, NYJ)"
363,"Craig Reynolds  C. Reynolds  (RB, DET)"
364,"Alec Ingold  A. Ingold  (RB, MIA)"
365,"Dare Ogunbowale  D. Ogunbowale  (RB, HOU)"
366,"Travis Homer  T. Homer  (RB, CHI)"
367,"Salvon Ahmed  S. Ahmed  (RB, MIA)"
368,"Hassan Haskins  H. Haskins  (RB, LAC)"
369,"Jordan Mims  J. Mims  (RB, NO)"
370,"Patrick Ricard  P. Ricard  (RB, BAL)"
371,"Quintin Morris  Q. Morris  (TE, BUF)"
372,"Teagan Quitoriano  T. Quitoriano  (TE, HOU)"
373,"Tyler Goodson  T. Goodson  (RB, IND)"
374,"Adam Prentice  A. Prentice  (RB, NO)"
375,"Tre' McKitty  T. McKitty  (TE, BUF)"
376,"Patrick Taylor  P. Taylor  (RB, SF)"
377,"Xavier Hutchinson  X. Hutchinson  (WR, HOU)"
378,"Ben Sims  B. Sims  (TE, GB)"
379,"Bo Melton  B. Melton  (WR, GB)"
380,"Brenton Strange  B. Strange  (TE, JAC)"
381,"Tommy Hudson  T. Hudson  (TE, NO)"
382,"Luke Farrell  L. Farrell  (TE, JAC)"
383,"Stephen Carlson  S. Carlson  (TE, CHI)"
384,"Seth Williams  S. Williams  (WR, JAC)"
385,"Montrell Washington  M. Washington  (WR, KC)"
386,"Brady Russell  B. Russell  (TE, SEA)"
387,"Kwamie Lassiter II  K. Lassiter II  (WR, CIN)"
388,"Tim Jones  T. Jones  (WR, JAC)"
389,"Cephus Johnson  C. Johnson  (WR, TB)"
390,"Jason Brownlee  J. Brownlee  (WR, NYJ)"
391,"Charlie Kolar  C. Kolar  (TE, BAL)"
392,"Payne Durham  P. Durham  (TE, TB)"
393,"Kyle Philips  K. Philips  (WR, PHI)"
394,"Irvin Charles  I. Charles  (WR, NYJ)"
395,"Tyler Scott  T. Scott  (WR, CHI)"
396,"Cody White  C. White  (WR, SEA)"
397,"Julius Chestnut  J. Chestnut  (RB, TEN)"
398,"C.J. Ham  C. Ham  (RB, MIN)"
399,"Nate Adkins  N. Adkins  (TE, DEN)"
400,"Chris Manhertz  C. Manhertz  (TE, NYG)"
401,"Jake Tonges  J. Tonges  (TE, SF)"
402,"Raleigh Webb  R. Webb  (WR, BAL)"
403,"Jeremy McNichols  J. McNichols  (RB, WSH)"
404,"Tylan Wallace  T. Wallace  (WR, BAL)"
405,"Trishton Jackson  T. Jackson  (WR, MIN)"
406,"Zach Gentry  Z. Gentry  (TE, LV)"
407,"Jashaun Corbin  J. Corbin  (RB, NYG)"
408,"Boston Scott  B. Scott  (RB, PIT)"
409,"Kristian Wilkerson  K. Wilkerson  (WR, LV)"
410,"DJ Turner  D. Turner  (WR, LV)"
411,"Joshua Kelley  J. Kelley  (RB, NYG)"
412,"DeeJay Dallas  D. Dallas  (RB, ARI)"
413,"Kayshon Boutte  K. Boutte  (WR, NE)"
414,"Mitchell Wilcox  M. Wilcox  (TE, NE)"
415,"David Sills V  D. Sills  (WR, DEN)"
416,"Jeff Smith  J. Smith  (WR, ARI)"
417,"Zach Wilson  Z. Wilson  (QB, DEN)"
418,"Trey Lance  T. Lance  (QB, DAL)"
419,"Tommy Tremble  T. Tremble  (TE, CAR)"
420,"Kendre Miller  K. Miller  (RB, NO)"
421,"Mac Jones  M. Jones  (QB, JAC)"
422,"Davis Mills  D. Mills  (QB, HOU)"
423,"Sam Ehlinger  S. Ehlinger  (QB, IND)"
424,"Kenny Yeboah  K. Yeboah  (TE, NYJ)"
425,"Kenny Pickett  K. Pickett  (QB, PHI)"
426,"Peyton Hendershot  P. Hendershot  (TE, KC)"
427,"Skylar Thompson  S. Thompson  (QB, MIA)"
428,"Sam Howell  S. Howell  (QB, SEA)"
429,"Kyle Trask  K. Trask  (QB, TB)"
430,"MarShawn Lloyd  M. Lloyd  (RB, GB)"
431,"Josh Downs  J. Downs  (WR, IND)"
432,"Malik Heath  M. Heath  (WR, GB)"
433,"Jake Browning  J. Browning  (QB, CIN)"
434,"Aidan O'Connell  A. O'Connell  (QB, LV)"
435,"Dorian Thompson-Robinson  D. Thompson-Robinson  (QB, CLE)"
436,"Tyson Bagent  T. Bagent  (QB, CHI)"
437,"Keaton Mitchell  K. Mitchell  (RB, BAL)"
438,"Clayton Tune  C. Tune  (QB, ARI)"
439,"Tommy DeVito  T. DeVito  (QB, NYG)"
440,"Jonathon Brooks  J. Brooks  (RB, CAR)"
441,"Drake Maye  D. Maye  (QB, NE)"
442,"Roman Wilson  R. Wilson  (WR, PIT)"
443,"Ricky Pearsall  R. Pearsall  (WR, SF)"
444,"Clyde Edwards-Helaire  C. Edwards-Helaire  (RB, KC)"
445,"Easton Stick  E. Stick  (QB, LAC)"
446,"Russell Wilson  R. Wilson  (QB, PIT)"
447,"Tee Higgins  T. Higgins  (WR, CIN)"
448,"Kendrick Bourne  K. Bourne  (WR, NE)"
449,"Joe Flacco  J. Flacco  (QB, IND)"
450,"Josh Johnson  J. Johnson  (QB, BAL)"
451,"Andy Dalton  A. Dalton  (QB, CAR)"
452,"Tyrod Taylor  T. Taylor  (QB, NYJ)"
453,"Odell Beckham  O. Beckham  (WR, MIA)"
454,"Jimmy Garoppolo  J. Garoppolo  (QB, LA)"
455,"Jameis Winston  J. Winston  (QB, CLE)"
456,"Marcus Mariota  M. Mariota  (QB, WSH)"
457,"Carson Wentz  C. Wentz  (QB, KC)"
458,"Tyler Higbee  T. Higbee  (TE, LA)"
459,"Mitchell Trubisky  M. Trubisky  (QB, BUF)"
460,"Cooper Rush  C. Rush  (QB, DAL)"
461,"Nick Chubb  N. Chubb  (RB, CLE)"
462,"Brandon Allen  B. Allen  (QB, SF)"
463,"Nyheim Hines  N. Hines  (RB, CLE)"
464,"D.J. Chark  D. Chark  (WR, LAC)"
465,"Ian Thomas  I. Thomas  (TE, CAR)"
466,"Joshua Dobbs  J. Dobbs  (QB, SF)"
467,"Jeff Driskel  J. Driskel  (QB, WSH)"
468,"Nick Mullens  N. Mullens  (QB, MIN)"
469,"River Cracraft  R. Cracraft  (WR, MIA)"
470,"Kyle Allen  K. Allen  (QB, PIT)"
471,"Marquise Brown  M. Brown  (WR, KC)"
472,"T.J. Hockenson  T. Hockenson  (TE, MIN)"
473,"Drew Lock  D. Lock  (QB, NYG)"
474,"Mason Rudolph  M. Rudolph  (QB, TEN)"
475,"Jarrett Stidham  J. Stidham  (QB, DEN)"
476,"Michael Penix Jr.  M. Penix  (QB, ATL)"
